{"id":"shadowmetrics_1","specVersion":"0.2","tenantId":"tenant_demo","periodStart":"2026-09-01T00:00:00Z","periodEnd":"2026-09-30T23:59:59Z","totals":{"autoExecuted":120,"approvalRequested":45,"blocked":15,"shadowRuns":180},"byActionType":[{"actionType":"refund","autoExecuted":60,"approvalRequested":30,"blocked":10},{"actionType":"credit_apply","autoExecuted":20,"approvalRequested":10,"blocked":5}],"rates":{"autoExecuteRate":0.6667,"approvalRate":0.25,"blockRate":0.0833,"shadowCoveragePct":1},"createdAt":"2026-09-30T23:59:59Z","updatedAt":"2026-09-30T23:59:59Z"}
